{
  "baselineId": "native-baseline@3",
  "version": "3",
  "status": "proposed",
  "description": "The recommended path through the current native formats with the carried record version 3 as the current record and versions 1 and 2 read beside it, because a lineage may hold either earlier version and a carried lineage holds version 3 alone. The same selection as native-baseline@2 for the native claim, the anchor, the report and the managed acceptance record; what is added is the BRC-162 token prefix in front of the seventeen-field body, the token id every later state carries, the version 3 derivation and the version 3 fixtures. A conformance and documentation selection: nothing here changes a byte of an earlier version, revives a refused format or requires every deployment to fill every role.",
  "wire": {
    "record": {
      "protocolMarker": "dpp",
      "version": "3",
      "fieldCount": 17,
      "specification": "spec/token-carrier.md",
      "carrier": {
        "prefixDeploy": "OP_0 OP_1 OP_2DROP",
        "prefixValue": "<32-byte token id> OP_1 OP_2DROP",
        "tokenIdBytes": 32,
        "amount": 1,
        "deployOutputIndex": 0,
        "specification": "spec/token-carrier.md#3-the-prefix"
      },
      "alsoReads": [
        {
          "version": "2",
          "fieldCount": 17,
          "specification": "spec/record-model-v2.md",
          "rule": "A bare seventeen-field body is version 2 and one behind a token prefix is version 3; a reader selects the version by the prefix and the field count and reads each state under its own version; no version crosses into or out of a carried lineage (spec/token-carrier.md section 6)."
        },
        {
          "version": "1",
          "fieldCount": 14,
          "specification": "spec/record-model.md",
          "rule": "A fourteen-field body is version 1; a version 1 lineage continues under version 2 only through the upgrade transition of spec/record-model-v2.md section 6, and never into a carried lineage."
        }
      ]
    },
    "nativeClaim": {
      "claimFormat": "dpp-lifecycle-v1",
      "specification": "spec/rules.md#3-native-signed-claim"
    },
    "anchor": {
      "prefix": "bsv-attestation-anchor-v1",
      "signedFieldCount": 9,
      "dropCount": 5,
      "specification": "spec/rules.md#5-bsv-anchor-v1"
    },
    "verificationReport": {
      "reportVersion": "1",
      "schema": "contracts/verification-report.schema.json",
      "checkNames": [
        "recordEncoding",
        "actorSignatures",
        "publisherSignatures",
        "linkage",
        "inclusion",
        "nativeAttestationSignature",
        "anchorSignature",
        "anchorKeyDerivation",
        "anchorDigestAndMetadataBinding",
        "externalCredentialProof",
        "subjectBinding",
        "issuerAuthority",
        "schema",
        "credentialTime",
        "credentialStatus",
        "evidenceAvailability"
      ]
    }
  },
  "derivations": {
    "userSignature": {
      "protocolId": [
        1,
        "dpp token v1"
      ],
      "keyId": "actor_keyID (field 8)",
      "counterparty": "anyone"
    },
    "serverSignature": {
      "protocolId": [
        1,
        "dpp token v1"
      ],
      "keyId": "passport_id (field 3)",
      "counterparty": "anyone"
    },
    "actorSignatureV2": {
      "protocolId": [
        1,
        "dpp token v2"
      ],
      "keyId": "actor_keyID (field 8)",
      "counterparty": "anyone"
    },
    "publisherSignatureV2": {
      "protocolId": [
        1,
        "dpp token v2"
      ],
      "keyId": "passport_id (field 3)",
      "counterparty": "anyone"
    },
    "actorSignatureV3": {
      "protocolId": [
        1,
        "dpp token v3"
      ],
      "keyId": "actor_keyID (field 8)",
      "counterparty": "anyone"
    },
    "publisherSignatureV3": {
      "protocolId": [
        1,
        "dpp token v3"
      ],
      "keyId": "passport_id (field 3)",
      "counterparty": "anyone"
    },
    "ownerKey": {
      "protocolId": [
        1,
        "dpp owner v1"
      ],
      "keyId": "passport_id",
      "counterparty": "self"
    },
    "controllerKey": {
      "protocolId": [
        1,
        "dpp owner v1"
      ],
      "keyId": "passport_id",
      "counterparty": "self"
    },
    "nativeClaimSignature": {
      "protocolId": [
        1,
        "dpp attestation v1"
      ],
      "keyId": "passportId",
      "counterparty": "anyone"
    },
    "anchorSignature": {
      "protocolId": [
        1,
        "bsv attestation anchor v1"
      ],
      "keyId": "attestationId",
      "counterparty": "anyone"
    }
  },
  "representations": [
    {
      "id": "dpp-lifecycle-json-v1",
      "mediaType": "application/json",
      "bytesHashed": "restricted canonical JSON of the complete signed native claim, including signature",
      "specification": "spec/rules.md#4-secured-representation-bytes"
    },
    {
      "id": "vsc-seal-json-v1",
      "mediaType": "application/vc+ld+json",
      "bytesHashed": "exact UTF-8 bytes of the complete issued credential, including its Data Integrity proof",
      "specification": "spec/vsc-profile.md"
    },
    {
      "id": "dpp-managed-acceptance-v1",
      "mediaType": "application/json",
      "bytesHashed": "canonical JSON (nested, code-unit sorted, no whitespace, strings and safe integers only) of the complete signed acceptance record, including signature; the custodian signs the same form without signature",
      "specification": "spec/managed-custody.md#3-the-acceptance-record"
    }
  ],
  "refused": [
    "uora-anchor-v2"
  ],
  "historical": [
    "uora-anchor-v1",
    "uora-anchor-v3",
    "tm_uora_dpp",
    "ls_uora_dpp",
    "uora_type"
  ],
  "reasonCodes": "contracts/verification-report.schema.json#/$defs/sharedReasonCode",
  "roles": {
    "passport-reader": {
      "responsibility": "Decode and verify supplied token history of any record version, carried or bare, and report the scope of the finding.",
      "requires": [
        "RM-2-script",
        "RM-2-minimal-push",
        "RM-3-fields",
        "RM-4-operations",
        "RM-5-signatures",
        "RM-6-invariants",
        "RM-7-owner-tier",
        "RM-8-verifier",
        "VER-2-report",
        "VER-3-expected-subject",
        "VER-4-checks",
        "VER-5-observations",
        "CONF-2-reader-quickstart",
        "RM2-2-script",
        "RM2-3-fields",
        "RM2-4-operations",
        "RM2-5-signatures",
        "RM2-6-invariants",
        "RM2-6-control-proof",
        "RM2-8-commitment",
        "RM2-9-verifier",
        "VER-4-version-2-findings",
        "CAR-2-script",
        "CAR-3-prefix",
        "CAR-4-body",
        "CAR-5-token-id",
        "CAR-6-invariants",
        "CAR-7-burn",
        "CAR-10-verification",
        "CAR-12-conformance"
      ],
      "optional": [
        "CUST-4-owner-consent",
        "MC-3-acceptance-record",
        "MC-4-transfer-binding",
        "MC-5-verification-report"
      ],
      "testTargets": [
        "fixtures/record-v1.json",
        "fixtures/chain-v1.json",
        "fixtures/evidence-v1.json",
        "examples/verify-passport.mjs --fixture --report",
        "fixtures/record-v2.json",
        "fixtures/chain-v2.json",
        "fixtures/managed-acceptance-v1.json",
        "fixtures/evidence-v2.json",
        "examples/verify-passport.mjs --fixture --version=2 --report",
        "fixtures/record-v3.json",
        "fixtures/chain-v3.json",
        "fixtures/evidence-v3.json",
        "examples/verify-passport.mjs --fixture --version=3 --report"
      ]
    },
    "attestation-verifier": {
      "responsibility": "Verify supplied claim signatures, anchor attribution, digest and metadata binding, and the selected authority and status evidence, reporting what could not be checked.",
      "requires": [
        "RULES-3-native-claim",
        "RULES-4-representation-bytes",
        "RULES-5-anchor",
        "RULES-6-verification",
        "RULES-7-compatibility",
        "VER-2-report",
        "VER-4-checks",
        "ID-2-did-key"
      ],
      "optional": [
        "VSC-2-structure",
        "VSC-3-proofs",
        "VSC-4-status",
        "VSC-4-authority",
        "VSC-5-custody"
      ],
      "testTargets": [
        "fixtures/attestation-anchor-v1.json",
        "fixtures/anchor-v3.json",
        "fixtures/evidence-v1.json",
        "examples/verify-attestation-anchor.mjs"
      ]
    },
    "passport-writer": {
      "responsibility": "Construct valid states, carried or bare, and discharge the broadcast, serialisation, announcement, proof and retention duties.",
      "requires": [
        "RM-2-script",
        "RM-3-fields",
        "RM-5-signatures",
        "RM-6-invariants",
        "WR-2-verify-before-send",
        "WR-4-one-writer",
        "WR-5-broadcast",
        "WR-6-announce-retry",
        "WR-7-proof",
        "WR-8-retain",
        "RM2-2-script",
        "RM2-3-fields",
        "RM2-4-operations",
        "RM2-5-signatures",
        "RM2-6-invariants",
        "RM2-6-control-proof",
        "RM2-8-commitment",
        "CAR-2-script",
        "CAR-3-prefix",
        "CAR-4-body",
        "CAR-5-token-id",
        "CAR-6-invariants",
        "CAR-7-burn",
        "CAR-8-writing"
      ],
      "optional": [
        "WR-3-announce-before-send",
        "RM-3-gs1-allocation",
        "GS1-check-digit-written",
        "GS1-952-demonstration",
        "MC-3-acceptance-record",
        "MC-4-transfer-binding",
        "MC-4-offer-lifecycle"
      ],
      "testTargets": [
        "examples/write-passport.mjs --dry-run",
        "writer self-report, one sentence per rule (GOVERNANCE.md)",
        "examples/lifecycle-v2.mjs",
        "examples/lifecycle-v3.mjs"
      ]
    },
    "attestation-issuer": {
      "responsibility": "Sign attributable lifecycle claims under the declared format and profile, without spending the passport token.",
      "requires": [